{
  "asr_spec_version": "0.3.0",
  "facets": [
    {
      "id": "governance_domain",
      "label": "Governance domain",
      "values": [
        {
          "id": "legislative",
          "label": "Legislative"
        },
        {
          "id": "regulatory",
          "label": "Regulatory"
        }
      ]
    }
  ],
  "provenance": {
    "produced_by": {
      "tool": "build-fixtures",
      "tool_version": "0.3.0",
      "model": null,
      "method": "fixture",
      "person": null
    },
    "created_at": "2026-08-17T12:00:00.000Z",
    "modified_at": null
  },
  "notes": ""
}
