{
  "asr_spec_version": "0.4.0",
  "registry_id": "reg-6a6e91e4038a",
  "facets": [
    {
      "id": "reader_access",
      "label": "Reader access",
      "description": "What it takes to read the source's articles in full. Distinct from the scholarly registry's access_model (API access).",
      "values": [
        {
          "id": "free",
          "label": "Free",
          "description": "Free to read in full, no account needed."
        },
        {
          "id": "metered",
          "label": "Metered",
          "description": "Some free articles, then a paywall or sign-in."
        },
        {
          "id": "paid",
          "label": "Paid",
          "description": "Mostly subscriber-only."
        },
        {
          "id": "mixed",
          "label": "Mixed",
          "description": "Per-article: some posts free, some paid (e.g. a Substack)."
        }
      ]
    },
    {
      "id": "voice",
      "label": "Voice",
      "description": "Who is speaking, which decides how a claim is used.",
      "values": [
        {
          "id": "press",
          "label": "Press and critics",
          "description": "Journalism, criticism and reviews."
        },
        {
          "id": "presenter",
          "label": "Presenters and labels",
          "description": "Orchestras, ensembles, venues and record labels writing about music they present or record (program notes, liner notes)."
        },
        {
          "id": "artist",
          "label": "Artists",
          "description": "Performers' and composers' own sites."
        },
        {
          "id": "reference",
          "label": "Reference",
          "description": "Encyclopedias and catalogues."
        },
        {
          "id": "platform",
          "label": "Platform",
          "description": "A host of many independent writers; authority is each author's."
        }
      ]
    }
  ],
  "provenance": {
    "produced_by": {
      "tool": "claude-code",
      "tool_version": "",
      "model": "claude-opus-5-5",
      "method": "model",
      "person": null
    },
    "created_at": "2026-09-29T00:00:00.000Z",
    "modified_at": null
  },
  "notes": ""
}
